{
  "name": "ralph-loop",
  "version": "1.0.0",
  "description": "Implementation of the Ralph Wiggum technique - continuous self-referential AI loops for interactive iterative development. Run Claude in a while-true loop with the same prompt until task completion.",
  "author": {
    "name": "Léo Brival",
    "email": "leo@topographic.studio"
  }
}
