{
  "name": "cli-toolkit",
  "version": "1.0.0",
  "description": "CLI reference commands for popular development tools - GitHub, Docker, Vercel, Railway, and more",
  "commands": ["./commands/*.md"],
  "skills": ["./skills/*.md"],
  "author": {
    "name": "Leo Brival",
    "email": "leo.brival@gmail.com"
  },
  "license": "MIT"
}
